{
  "$schema": "../schema/drills.schema.json",
  "file_kind": "drills",
  "version": "2026.10.0",
  "status": "draft",
  "licence": "CC-BY-4.0",
  "attribution": "Margdarshak content pack, team Chanakya (Nestiq Private Limited), 2026",
  "notes": "DEBRIEF_SPEC §4 with DR-NAZ-OCCL-<TYPE> expanded to one drill per NAZAR §3.3 hazard type (TYPE = hazard_type upper-cased, the convention game-core emits). availability marks drills whose game is not built in Phase 1–2 (GAME_DESIGN §1.4: G8/G9 storyboard only, G5 car segments later); coach and voice allowlists only take phase_1_2 drills.",
  "drills": [
    {
      "drill_id": "DR-NAZ-OCCL-BUS_STOP_PEDESTRIAN",
      "game_id": "nazar",
      "opens": "learn mode: 3 occlusion clips of hazard_type bus_stop_pedestrian",
      "levels": {
        "kind": "range",
        "min": 1,
        "max": 5
      },
      "deeplink": "margdarshak://play/nazar?drill=DR-NAZ-OCCL-BUS_STOP_PEDESTRIAN&level={level}",
      "hazard_type": "bus_stop_pedestrian",
      "skill_ids": ["SK-M18"],
      "why": {
        "en": "Short bus-stop clips that pause just before someone steps out.",
        "hi": "बस स्टॉप की छोटी क्लिप, जो किसी के सड़क पर आने से ठीक पहले रुकती हैं।"
      },
      "availability": "phase_1_2",
      "template_only": false,
      "review_status": "draft",
      "hi_review_status": "pending_native_review"
    },
    {
      "drill_id": "DR-NAZ-OCCL-DOOR_OPENING",
      "game_id": "nazar",
      "opens": "learn mode: 3 occlusion clips of hazard_type door_opening",
      "levels": {
        "kind": "range",
        "min": 1,
        "max": 5
      },
      "deeplink": "margdarshak://play/nazar?drill=DR-NAZ-OCCL-DOOR_OPENING&level={level}",
      "hazard_type": "door_opening",
      "skill_ids": ["SK-M5"],
      "why": {
        "en": "Clips past parked cars that pause just before a door opens.",
        "hi": "खड़ी कारों के पास की क्लिप, जो दरवाज़ा खुलने से ठीक पहले रुकती हैं।"
      },
      "availability": "phase_1_2",
      "template_only": false,
      "review_status": "draft",
      "hi_review_status": "pending_native_review"
    },
    {
      "drill_id": "DR-NAZ-OCCL-AUTO_CUT_IN",
      "game_id": "nazar",
      "opens": "learn mode: 3 occlusion clips of hazard_type auto_cut_in",
      "levels": {
        "kind": "range",
        "min": 1,
        "max": 5
      },
      "deeplink": "margdarshak://play/nazar?drill=DR-NAZ-OCCL-AUTO_CUT_IN&level={level}",
      "hazard_type": "auto_cut_in",
      "skill_ids": ["SK-M5"],
      "why": {
        "en": "Clips with autos ahead that pause just before one cuts in.",
        "hi": "आगे चलते ऑटो की क्लिप, जो किसी ऑटो के अचानक सामने आने से ठीक पहले रुकती हैं।"
      },
      "availability": "phase_1_2",
      "template_only": false,
      "review_status": "draft",
      "hi_review_status": "pending_native_review"
    },
    {
      "drill_id": "DR-NAZ-OCCL-WRONG_SIDE_2W",
      "game_id": "nazar",
      "opens": "learn mode: 3 occlusion clips of hazard_type wrong_side_2w",
      "levels": {
        "kind": "range",
        "min": 1,
        "max": 5
      },
      "deeplink": "margdarshak://play/nazar?drill=DR-NAZ-OCCL-WRONG_SIDE_2W&level={level}",
      "hazard_type": "wrong_side_2w",
      "skill_ids": ["SK-M9"],
      "why": {
        "en": "Clips that pause just before a two-wheeler appears on the wrong side.",
        "hi": "ऐसी क्लिप जो उल्टी दिशा से दोपहिया दिखने से ठीक पहले रुकती हैं।"
      },
      "availability": "phase_1_2",
      "template_only": false,
      "review_status": "draft",
      "hi_review_status": "pending_native_review"
    },
    {
      "drill_id": "DR-NAZ-OCCL-CATTLE_ANIMAL",
      "game_id": "nazar",
      "opens": "learn mode: 3 occlusion clips of hazard_type cattle_animal",
      "levels": {
        "kind": "range",
        "min": 1,
        "max": 5
      },
      "deeplink": "margdarshak://play/nazar?drill=DR-NAZ-OCCL-CATTLE_ANIMAL&level={level}",
      "hazard_type": "cattle_animal",
      "skill_ids": ["SK-M18"],
      "why": {
        "en": "Clips that pause just before an animal moves into the road.",
        "hi": "ऐसी क्लिप जो किसी जानवर के सड़क पर आने से ठीक पहले रुकती हैं।"
      },
      "availability": "phase_1_2",
      "template_only": false,
      "review_status": "draft",
      "hi_review_status": "pending_native_review"
    },
    {
      "drill_id": "DR-NAZ-OCCL-CHILD_SCHOOL",
      "game_id": "nazar",
      "opens": "learn mode: 3 occlusion clips of hazard_type child_school",
      "levels": {
        "kind": "range",
        "min": 1,
        "max": 5
      },
      "deeplink": "margdarshak://play/nazar?drill=DR-NAZ-OCCL-CHILD_SCHOOL&level={level}",
      "hazard_type": "child_school",
      "skill_ids": ["SK-M18"],
      "why": {
        "en": "School-gate clips that pause just before a child moves toward the road.",
        "hi": "स्कूल गेट की क्लिप, जो बच्चे के सड़क की ओर बढ़ने से ठीक पहले रुकती हैं।"
      },
      "availability": "phase_1_2",
      "template_only": false,
      "review_status": "draft",
      "hi_review_status": "pending_native_review"
    },
    {
      "drill_id": "DR-NAZ-OCCL-PEDESTRIAN_MEDIAN",
      "game_id": "nazar",
      "opens": "learn mode: 3 occlusion clips of hazard_type pedestrian_median",
      "levels": {
        "kind": "range",
        "min": 1,
        "max": 5
      },
      "deeplink": "margdarshak://play/nazar?drill=DR-NAZ-OCCL-PEDESTRIAN_MEDIAN&level={level}",
      "hazard_type": "pedestrian_median",
      "skill_ids": ["SK-M18"],
      "why": {
        "en": "Clips that pause just before someone steps off the median.",
        "hi": "ऐसी क्लिप जो किसी के डिवाइडर से उतरने से ठीक पहले रुकती हैं।"
      },
      "availability": "phase_1_2",
      "template_only": false,
      "review_status": "draft",
      "hi_review_status": "pending_native_review"
    },
    {
      "drill_id": "DR-NAZ-OCCL-VEHICLE_PULLING_OUT",
      "game_id": "nazar",
      "opens": "learn mode: 3 occlusion clips of hazard_type vehicle_pulling_out",
      "levels": {
        "kind": "range",
        "min": 1,
        "max": 5
      },
      "deeplink": "margdarshak://play/nazar?drill=DR-NAZ-OCCL-VEHICLE_PULLING_OUT&level={level}",
      "hazard_type": "vehicle_pulling_out",
      "skill_ids": ["SK-M6"],
      "why": {
        "en": "Clips that pause just before a vehicle pulls out from the side.",
        "hi": "ऐसी क्लिप जो किसी वाहन के किनारे से निकलने से ठीक पहले रुकती हैं।"
      },
      "availability": "phase_1_2",
      "template_only": false,
      "review_status": "draft",
      "hi_review_status": "pending_native_review"
    },
    {
      "drill_id": "DR-NAZ-OCCL-TRUCK_LEFT_TURN",
      "game_id": "nazar",
      "opens": "learn mode: 3 occlusion clips of hazard_type truck_left_turn",
      "levels": {
        "kind": "range",
        "min": 1,
        "max": 5
      },
      "deeplink": "margdarshak://play/nazar?drill=DR-NAZ-OCCL-TRUCK_LEFT_TURN&level={level}",
      "hazard_type": "truck_left_turn",
      "skill_ids": ["SK-M4"],
      "why": {
        "en": "Clips that pause just before a truck or bus turns left.",
        "hi": "ऐसी क्लिप जो ट्रक या बस के बाएँ मुड़ने से ठीक पहले रुकती हैं।"
      },
      "availability": "phase_1_2",
      "template_only": false,
      "review_status": "draft",
      "hi_review_status": "pending_native_review"
    },
    {
      "drill_id": "DR-NAZ-OCCL-JUNCTION_EMERGING",
      "game_id": "nazar",
      "opens": "learn mode: 3 occlusion clips of hazard_type junction_emerging",
      "levels": {
        "kind": "range",
        "min": 1,
        "max": 5
      },
      "deeplink": "margdarshak://play/nazar?drill=DR-NAZ-OCCL-JUNCTION_EMERGING&level={level}",
      "hazard_type": "junction_emerging",
      "skill_ids": ["SK-M6"],
      "why": {
        "en": "Junction clips that pause just before a vehicle comes out.",
        "hi": "चौराहे की क्लिप, जो किसी वाहन के निकलने से ठीक पहले रुकती हैं।"
      },
      "availability": "phase_1_2",
      "template_only": false,
      "review_status": "draft",
      "hi_review_status": "pending_native_review"
    },
    {
      "drill_id": "DR-NAZ-OCCL-OVERTAKING_ONCOMING",
      "game_id": "nazar",
      "opens": "learn mode: 3 occlusion clips of hazard_type overtaking_oncoming",
      "levels": {
        "kind": "range",
        "min": 1,
        "max": 5
      },
      "deeplink": "margdarshak://play/nazar?drill=DR-NAZ-OCCL-OVERTAKING_ONCOMING&level={level}",
      "hazard_type": "overtaking_oncoming",
      "skill_ids": ["SK-M7"],
      "why": {
        "en": "Clips that pause just before an oncoming vehicle pulls out to overtake.",
        "hi": "ऐसी क्लिप जो सामने के वाहन के ओवरटेक के लिए निकलने से ठीक पहले रुकती हैं।"
      },
      "availability": "phase_1_2",
      "template_only": false,
      "review_status": "draft",
      "hi_review_status": "pending_native_review"
    },
    {
      "drill_id": "DR-NAZ-OCCL-PARKED_VEHICLE_HIDDEN",
      "game_id": "nazar",
      "opens": "learn mode: 3 occlusion clips of hazard_type parked_vehicle_hidden",
      "levels": {
        "kind": "range",
        "min": 1,
        "max": 5
      },
      "deeplink": "margdarshak://play/nazar?drill=DR-NAZ-OCCL-PARKED_VEHICLE_HIDDEN&level={level}",
      "hazard_type": "parked_vehicle_hidden",
      "skill_ids": ["SK-M6"],
      "why": {
        "en": "Clips that pause just before someone appears from behind a parked vehicle.",
        "hi": "ऐसी क्लिप जो खड़ी गाड़ी के पीछे से किसी के निकलने से ठीक पहले रुकती हैं।"
      },
      "availability": "phase_1_2",
      "template_only": false,
      "review_status": "draft",
      "hi_review_status": "pending_native_review"
    },
    {
      "drill_id": "DR-NAZ-OCCL-CYCLIST",
      "game_id": "nazar",
      "opens": "learn mode: 3 occlusion clips of hazard_type cyclist",
      "levels": {
        "kind": "range",
        "min": 1,
        "max": 5
      },